{
  "circle": "Leaf",
  "rules": {
    "maxSyllables": 3,
    "maxSentenceWords": 16,
    "avgSentenceWords": [
      7,
      11
    ],
    "bookWords": [
      2000,
      4000
    ],
    "chapterWords": [
      300,
      600
    ],
    "pageWords": [
      50,
      130
    ],
    "maxStoryWordsPerBook": 10,
    "outOfScope": [
      {
        "pattern": "ough|augh|eigh",
        "label": "ough / augh / eigh (Branch)"
      },
      {
        "pattern": "ous$|ment$|ible$|able$",
        "label": "-ous / -ment / -ible / -able (Branch)"
      }
    ]
  },
  "heartWords": [
    "busy",
    "build",
    "built",
    "answer",
    "enough",
    "though",
    "through",
    "thought",
    "brought",
    "bought",
    "caught",
    "taught",
    "eight",
    "weigh",
    "neighbor",
    "ocean",
    "island",
    "listen",
    "often",
    "whose",
    "sugar",
    "special",
    "machine",
    "piece",
    "believe",
    "field"
  ],
  "words": []
}
